{
    "$schema": "https://raw.githubusercontent.com/lszeremeta/knows/main/knows/schema.json",
    "nodeLabel": "Concept",
    "edgeLabel": "relatedTo",
    "nodeProperties": {
        "name": "String",
        "definition": "Paragraph",
        "shortDescription": "Sentence",
        "domain": {"enum": ["Science", "Technology", "Arts", "History", "Geography", "Mathematics", "Philosophy", "Medicine", "Law", "Economics"]},
        "subdomain": "String",
        "aliases": "String",
        "importance": {"type": "Float", "min": 0.0, "max": 1.0},
        "complexity": {"type": "Float", "min": 0.0, "max": 1.0},
        "sourceUrl": "Url",
        "createdAt": "Date",
        "lastUpdated": "Date",
        "isVerified": "Boolean"
    },
    "edgeProperties": {
        "relationshipType": {"enum": ["isA", "partOf", "causes", "oppositeOf", "prerequisiteFor", "derivedFrom", "relatedTo", "instanceOf", "usedIn", "discoveredBy"]},
        "strength": {"type": "Float", "min": 0.0, "max": 1.0},
        "confidence": {"type": "Float", "min": 0.0, "max": 1.0},
        "source": "String",
        "verifiedAt": "Date"
    }
}
