{
    "$schema": "https://raw.githubusercontent.com/lszeremeta/knows/main/knows/schema.json",
    "nodeLabel": "Employee",
    "edgeLabel": "collaboratesWith",
    "nodeProperties": {
        "employeeId": "Uuid",
        "firstName": "FirstName",
        "lastName": "LastName",
        "email": "Email",
        "phone": "Phone",
        "jobTitle": "Job",
        "department": {"enum": ["Engineering", "Marketing", "Sales", "HR", "Finance", "Legal", "Operations", "Product", "Design", "Support"]},
        "office": "City",
        "salary": {"type": "Int", "min": 35000, "max": 250000},
        "hireDate": "Date",
        "birthDate": "Date",
        "isManager": "Boolean",
        "isRemote": "Boolean",
        "yearsOfExperience": {"type": "Int", "min": 0, "max": 40},
        "performanceRating": {"type": "Float", "min": 1.0, "max": 5.0, "precision": 1},
        "probationPeriod": {"type": "DURATION", "min": "P1M", "max": "P6M"}
    },
    "edgeProperties": {
        "sharedProjects": {"type": "Int", "min": 1, "max": 50, "symmetric": true},
        "collaborationStrength": {"type": "Float", "min": 0.0, "max": 1.0, "symmetric": true},
        "since": {"type": "Date", "symmetric": true},
        "lastInteraction": {"type": "Date", "symmetric": true},
        "totalCollaborationTime": {"type": "Duration", "min": "P7D", "max": "P3Y", "symmetric": true},
        "collaborationType": {"enum": ["sameTeam", "crossFunctional", "mentorship", "projectBased"]}
    },
    "computedNodeProperties": {
        "collaboratorCount": "degree"
    }
}
